ФИО,Суд,Позиция,Назначен/Освобожден,Комментарий,Тип периода,Период
Анискевич Руслан Геннадьевич,07-000-00-02,судья,назначен,,бессрочно,
Анискевич Руслан Геннадьевич,07-000-00-02,судья,освобожден,в связи с истечением срока полномочий,,
Забара Андрей Александрович,07-000-00-02,судья и заместитель председателя суда,назначен,,бессрочно,
Калинкович Валерий Леонидович,07-000-00-02,судья и первый заместитель председателя суда,назначен,,бессрочно,
Кондратьев Сергей Вадимович,07-000-00-02,судья и заместитель председателя суда,назначен,,бессрочно,
